{
  "$schema": "https://json-schema.org/draft/2020-12/schema",
  "$id": "https://majiayu000.github.io/remem/schemas/memory-run.schema.json",
  "title": "remem public memory run artifact",
  "type": "object",
  "required": ["schema_version", "benchmark_id", "benchmark_version", "layer", "suite", "condition", "task_id", "run_index", "reference_time_epoch", "reader_model", "environment", "answer", "retrieval", "evidence", "metrics", "diagnosis", "artifacts"],
  "properties": {
    "schema_version": { "const": 1 },
    "layer": { "const": "memory_system_capability" },
    "benchmark_id": { "type": "string", "minLength": 1 },
    "benchmark_version": { "type": "string", "minLength": 1 },
    "suite": { "type": "string", "minLength": 1 },
    "suite_content_identity": {
      "type": "string",
      "pattern": "^sha256-raw-suite-v1:[0-9a-f]{64}$"
    },
    "condition": { "type": "string", "minLength": 1 },
    "task_id": { "type": "string", "minLength": 1 },
    "run_index": { "type": "integer", "minimum": 0 },
    "reference_time_epoch": { "type": "integer", "minimum": 1 },
    "reader_model": { "type": "object" },
    "environment": { "$ref": "#/$defs/environment" },
    "answer": { "type": "object" },
    "retrieval": { "type": "object" },
    "evidence": { "type": "object" },
    "metrics": { "type": "object" },
    "diagnosis": { "type": "object" },
    "artifacts": { "type": "object" },
    "artifact_sha256": {
      "type": "object",
      "additionalProperties": { "type": "string", "pattern": "^[0-9a-f]{64}$" }
    }
  },
  "allOf": [
    {
      "if": {
        "properties": {
          "benchmark_id": { "const": "adversarial-policy" },
          "benchmark_version": { "const": "v2" }
        },
        "required": ["benchmark_id", "benchmark_version"]
      },
      "then": {
        "required": ["artifact_sha256", "suite_content_identity"],
        "properties": {
          "artifacts": {
            "required": ["reader_input", "retrieved_evidence", "answer", "score", "diagnosis", "remem_db_snapshot"],
            "properties": {
              "reader_input": { "type": "string", "minLength": 1 },
              "retrieved_evidence": { "type": "string", "minLength": 1 },
              "answer": { "type": "string", "minLength": 1 },
              "score": { "type": "string", "minLength": 1 },
              "diagnosis": { "type": "string", "minLength": 1 },
              "remem_db_snapshot": { "type": "string", "minLength": 1 }
            }
          },
          "artifact_sha256": {
            "minProperties": 6,
            "required": ["reader_input", "retrieved_evidence", "answer", "score", "diagnosis", "remem_db_snapshot"]
          },
          "environment": {
            "required": ["os", "arch", "source_dirty", "production_input_tree_sha256"],
            "properties": {
              "source_dirty": { "const": false },
              "production_input_tree_sha256": {
                "type": "string",
                "pattern": "^[0-9a-f]{64}$"
              }
            }
          }
        }
      }
    }
  ],
  "$defs": {
    "environment": {
      "type": "object",
      "required": ["os", "arch", "remem_commit", "remem_data_dir"],
      "properties": {
        "os": { "type": "string", "minLength": 1 },
        "arch": { "type": "string", "minLength": 1 },
        "remem_commit": { "type": "string", "minLength": 1 },
        "remem_data_dir": { "type": "string", "minLength": 1 },
        "source_dirty": { "type": ["boolean", "null"] },
        "production_input_tree_sha256": { "type": ["string", "null"], "pattern": "^[0-9a-f]{64}$" },
        "docker_image_digest": { "type": ["string", "null"] },
        "fixture_revision": { "type": ["string", "null"] },
        "repo_base_commit": { "type": ["string", "null"] }
      }
    }
  }
}
