{
  "schema_version": 1,
  "benchmark_id": "adversarial-policy",
  "benchmark_version": "v2",
  "layer": "memory_system_capability",
  "suite": "adversarial-policy",
  "condition": "remem_default",
  "task_id": "negation-001",
  "run_index": 0,
  "reference_time_epoch": 1760000000,
  "reader_model": {
    "model": "deterministic-memory-reader",
    "prompt_hash": "sha256:c95e90dfc21f48899c1021adcc8336ebe7405945fe92a0a5abfd35c0cc9f24c9",
    "provider": "fixture",
    "temperature": 0
  },
  "environment": {
    "os": "macos",
    "arch": "x86_64",
    "remem_commit": "2c153b704597ee09eef9606f01167d25521174a6",
    "remem_data_dir": "temp://remem-memory-bench/adversarial-policy-v2/remem_default/negation-001",
    "docker_image_digest": "local-fixture-no-docker",
    "fixture_revision": "adversarial-policy-v2",
    "repo_base_commit": null,
    "source_dirty": false,
    "production_input_tree_sha256": "0bcc9d75fab03c140187021020a38e1b5231b439550a9d17ce8e31bdae909b8e"
  },
  "answer": {
    "abstained": true,
    "no_answer_correct": true,
    "score": 1.0,
    "score_method": "deterministic_fixture",
    "temporal_as_of_correct": true,
    "text": "Insufficient benchmark evidence to answer."
  },
  "retrieval": {
    "retrieved_memory_ids": [],
    "retrieved_supporting_evidence_ids": [],
    "gold_supporting_event_ids": [
      "negation-001:e1"
    ],
    "missing_supporting_evidence_ids": [
      "negation-001:e1"
    ]
  },
  "evidence": {
    "cited_memory_ids": [],
    "cited_event_ids": []
  },
  "metrics": {
    "abstention_accuracy": 1.0,
    "answer_score": 1.0,
    "citation_precision": 0.0,
    "citation_recall": 0.0,
    "end_to_end_latency_ms": 15,
    "forbidden_evidence_count": 0,
    "ingest_tokens": 0,
    "policy": {
      "active_claim_count": 0,
      "candidate_count": 0,
      "measurement_source": "sqlite_production_tables",
      "poisoning_applicable": false,
      "poisoning_generated_surface_blocked": false,
      "poisoning_scanner_matched": false,
      "poisoning_source_scanner_matched": false,
      "policy_failure_count": 0,
      "source_scanner_config": "scan_source_instruction_pattern(include_opaque_payload=false); generated_surfaces=scan_instruction_pattern(include_opaque_payload=true)",
      "summary_input_count": 0,
      "verification_path": "capture_observation_candidate_promotion"
    },
    "query_tokens": 28,
    "reader_tokens": 52,
    "retrieval_latency_ms": 8,
    "retrieved_memory_count": 0,
    "rows_written": 0,
    "staleness_accuracy": 1.0,
    "support_coverage": 0.0
  },
  "diagnosis": {
    "write_side_gap": true,
    "retrieval_side_gap": false,
    "reader_gap": false,
    "policy_abstention": true,
    "notes": [
      "missing supporting evidence: negation-001:e1"
    ]
  },
  "artifacts": {
    "answer": "memory/artifacts/adversarial-policy-v2-x86_64-apple-darwin/remem_default-negation-001/answer.json",
    "diagnosis": "memory/artifacts/adversarial-policy-v2-x86_64-apple-darwin/remem_default-negation-001/diagnosis.json",
    "reader_input": "memory/artifacts/adversarial-policy-v2-x86_64-apple-darwin/remem_default-negation-001/reader_input.txt",
    "remem_db_snapshot": "memory/artifacts/adversarial-policy-v2-x86_64-apple-darwin/remem_default-negation-001/remem.db.snapshot.sqlite3",
    "retrieved_evidence": "memory/artifacts/adversarial-policy-v2-x86_64-apple-darwin/remem_default-negation-001/retrieved_evidence.json",
    "score": "memory/artifacts/adversarial-policy-v2-x86_64-apple-darwin/remem_default-negation-001/score.json"
  },
  "artifact_sha256": {
    "answer": "4500d697f29f9e0cc3aae5f88cfab1ffb36a45f3eb99893dd279c71f42c8b6ed",
    "diagnosis": "5bcbf4f60d942626fbd559593ca4d2a41eaf9b40ce5b3c8f0638a3dd9eb0c7f3",
    "reader_input": "be7e90ccd12c60998323fdbaf8d14d9cb6518cb3b068d2d9eca3a01e5586d52d",
    "remem_db_snapshot": "145c68ea78a3de08dc56a4a51e9d1a613949887759d844141f6f9add8a128e13",
    "retrieved_evidence": "498e685b8662f9858755367e9c9cd6dbbff37a751dcacfaa548ace11c6abdf05",
    "score": "9104fa05eb1c5d505b05892d47133caa21b33deba83a24a136a3fcc88446bf64"
  },
  "suite_content_identity": "sha256-raw-suite-v1:56dad240cc175fb3d3900875f05351b9541f9ef845aa54eddfc460151f3e257d"
}