{
  "schema_version": 1,
  "benchmark_id": "adversarial-policy",
  "benchmark_version": "v2",
  "layer": "memory_system_capability",
  "suite": "adversarial-policy",
  "condition": "remem_default",
  "task_id": "same-name-repos-001",
  "run_index": 0,
  "reference_time_epoch": 1760000000,
  "reader_model": {
    "model": "deterministic-memory-reader",
    "prompt_hash": "sha256:d05060faf53bc785faa31dff4f854d3bd3ccdbc902a85dd94c8155973b8d3184",
    "provider": "fixture",
    "temperature": 0
  },
  "environment": {
    "os": "macos",
    "arch": "aarch64",
    "remem_commit": "c144b36a39415a28cd761d48b5ff78c88a6dfb10",
    "remem_data_dir": "temp://remem-memory-bench/adversarial-policy-v2/remem_default/same-name-repos-001",
    "docker_image_digest": "local-fixture-no-docker",
    "fixture_revision": "adversarial-policy-v2",
    "repo_base_commit": null,
    "source_dirty": false,
    "production_input_tree_sha256": "162894304341909c4822a28126e73ab39ec022ab8379426834137850a78bf794"
  },
  "answer": {
    "abstained": true,
    "no_answer_correct": true,
    "score": 1.0,
    "score_method": "deterministic_fixture",
    "temporal_as_of_correct": true,
    "text": "Insufficient benchmark evidence to answer."
  },
  "retrieval": {
    "retrieved_memory_ids": [],
    "retrieved_supporting_evidence_ids": [],
    "gold_supporting_event_ids": [
      "same-name-001:e1"
    ],
    "missing_supporting_evidence_ids": [
      "same-name-001:e1"
    ]
  },
  "evidence": {
    "cited_memory_ids": [],
    "cited_event_ids": []
  },
  "metrics": {
    "abstention_accuracy": 1.0,
    "answer_score": 1.0,
    "citation_precision": 0.0,
    "citation_recall": 0.0,
    "end_to_end_latency_ms": 16,
    "forbidden_evidence_count": 0,
    "ingest_tokens": 0,
    "policy": {
      "active_claim_count": 0,
      "candidate_count": 0,
      "measurement_source": "sqlite_production_tables",
      "poisoning_applicable": false,
      "poisoning_generated_surface_blocked": false,
      "poisoning_scanner_matched": false,
      "poisoning_source_scanner_matched": false,
      "policy_failure_count": 0,
      "source_scanner_config": "scan_source_instruction_pattern(include_opaque_payload=false); generated_surfaces=scan_instruction_pattern(include_opaque_payload=true)",
      "summary_input_count": 0,
      "verification_path": "capture_observation_candidate_promotion"
    },
    "query_tokens": 28,
    "reader_tokens": 59,
    "retrieval_latency_ms": 8,
    "retrieved_memory_count": 0,
    "rows_written": 0,
    "staleness_accuracy": 1.0,
    "support_coverage": 0.0
  },
  "diagnosis": {
    "write_side_gap": true,
    "retrieval_side_gap": false,
    "reader_gap": false,
    "policy_abstention": true,
    "notes": [
      "missing supporting evidence: same-name-001:e1"
    ]
  },
  "artifacts": {
    "answer": "memory/artifacts/adversarial-policy-v2-aarch64-apple-darwin/remem_default-same-name-repos-001/answer.json",
    "diagnosis": "memory/artifacts/adversarial-policy-v2-aarch64-apple-darwin/remem_default-same-name-repos-001/diagnosis.json",
    "reader_input": "memory/artifacts/adversarial-policy-v2-aarch64-apple-darwin/remem_default-same-name-repos-001/reader_input.txt",
    "remem_db_snapshot": "memory/artifacts/adversarial-policy-v2-aarch64-apple-darwin/remem_default-same-name-repos-001/remem.db.snapshot.sqlite3",
    "retrieved_evidence": "memory/artifacts/adversarial-policy-v2-aarch64-apple-darwin/remem_default-same-name-repos-001/retrieved_evidence.json",
    "score": "memory/artifacts/adversarial-policy-v2-aarch64-apple-darwin/remem_default-same-name-repos-001/score.json"
  },
  "artifact_sha256": {
    "answer": "4500d697f29f9e0cc3aae5f88cfab1ffb36a45f3eb99893dd279c71f42c8b6ed",
    "diagnosis": "987df2247df7b2e78bd3d3f675bcac4663eca6854bcbb093ee318a7a7417d66d",
    "reader_input": "857b62f1592edd60a16750e07da7167130c03d8231b4b10a89d3d4f79a09ba25",
    "remem_db_snapshot": "31a2345f8b49e9dc97fca5721258ec0df497359f5bc8332985b605dd5fc6b53d",
    "retrieved_evidence": "5160975d41c6e7deffd62e69e123fa4b64525a27e67d6b228dc1838fac2acdad",
    "score": "9104fa05eb1c5d505b05892d47133caa21b33deba83a24a136a3fcc88446bf64"
  },
  "suite_content_identity": "sha256-raw-suite-v1:56dad240cc175fb3d3900875f05351b9541f9ef845aa54eddfc460151f3e257d"
}