{
  "schema_version": 1,
  "benchmark_id": "adversarial-policy",
  "benchmark_version": "v2",
  "layer": "memory_system_capability",
  "suite": "adversarial-policy",
  "condition": "remem_default",
  "task_id": "stale-file-anchor-001",
  "run_index": 0,
  "reference_time_epoch": 1760000000,
  "reader_model": {
    "model": "deterministic-memory-reader",
    "prompt_hash": "sha256:bd6cf67a345d7d2aa581fa6cbfbe20dd6fb63131e15685e7a8e225f1181e35d5",
    "provider": "fixture",
    "temperature": 0
  },
  "environment": {
    "os": "linux",
    "arch": "x86_64",
    "remem_commit": "5a9336898905a5d5d884c77bd457fddda609f1a0",
    "remem_data_dir": "temp://remem-memory-bench/adversarial-policy-v2/remem_default/stale-file-anchor-001",
    "docker_image_digest": "local-fixture-no-docker",
    "fixture_revision": "adversarial-policy-v2",
    "repo_base_commit": null,
    "source_dirty": false,
    "production_input_tree_sha256": "2b3e948c9b1662506baca78e077f1d9d55acc2c686d56fce46099a7f6839c916"
  },
  "answer": {
    "abstained": true,
    "no_answer_correct": true,
    "score": 1.0,
    "score_method": "deterministic_fixture",
    "temporal_as_of_correct": true,
    "text": "Insufficient benchmark evidence to answer."
  },
  "retrieval": {
    "retrieved_memory_ids": [],
    "retrieved_supporting_evidence_ids": [],
    "gold_supporting_event_ids": [
      "stale-anchor-001:e1"
    ],
    "missing_supporting_evidence_ids": [
      "stale-anchor-001:e1"
    ]
  },
  "evidence": {
    "cited_memory_ids": [],
    "cited_event_ids": []
  },
  "metrics": {
    "abstention_accuracy": 1.0,
    "answer_score": 1.0,
    "citation_precision": 0.0,
    "citation_recall": 0.0,
    "end_to_end_latency_ms": 16,
    "forbidden_evidence_count": 0,
    "ingest_tokens": 0,
    "policy": {
      "active_claim_count": 0,
      "candidate_count": 0,
      "measurement_source": "sqlite_production_tables",
      "poisoning_applicable": false,
      "poisoning_generated_surface_blocked": false,
      "poisoning_scanner_matched": false,
      "poisoning_source_scanner_matched": false,
      "policy_failure_count": 0,
      "source_scanner_config": "scan_source_instruction_pattern(include_opaque_payload=false); generated_surfaces=scan_instruction_pattern(include_opaque_payload=true)",
      "summary_input_count": 0,
      "verification_path": "capture_observation_candidate_promotion"
    },
    "query_tokens": 32,
    "reader_tokens": 61,
    "retrieval_latency_ms": 8,
    "retrieved_memory_count": 0,
    "rows_written": 0,
    "staleness_accuracy": 1.0,
    "support_coverage": 0.0
  },
  "diagnosis": {
    "write_side_gap": true,
    "retrieval_side_gap": false,
    "reader_gap": false,
    "policy_abstention": true,
    "notes": [
      "missing supporting evidence: stale-anchor-001:e1"
    ]
  },
  "artifacts": {
    "answer": "memory/artifacts/adversarial-policy-v2-linux-x86_64/remem_default-stale-file-anchor-001/answer.json",
    "diagnosis": "memory/artifacts/adversarial-policy-v2-linux-x86_64/remem_default-stale-file-anchor-001/diagnosis.json",
    "reader_input": "memory/artifacts/adversarial-policy-v2-linux-x86_64/remem_default-stale-file-anchor-001/reader_input.txt",
    "remem_db_snapshot": "memory/artifacts/adversarial-policy-v2-linux-x86_64/remem_default-stale-file-anchor-001/remem.db.snapshot.sqlite3",
    "retrieved_evidence": "memory/artifacts/adversarial-policy-v2-linux-x86_64/remem_default-stale-file-anchor-001/retrieved_evidence.json",
    "score": "memory/artifacts/adversarial-policy-v2-linux-x86_64/remem_default-stale-file-anchor-001/score.json"
  },
  "artifact_sha256": {
    "answer": "4500d697f29f9e0cc3aae5f88cfab1ffb36a45f3eb99893dd279c71f42c8b6ed",
    "diagnosis": "4216feb0a78e28f987080fa920f571922581b2355342e4478a3051bedab569da",
    "reader_input": "407852af091e7a9c1fff899f67ac31cd4e71e09649f6bba4487c55b24889febc",
    "remem_db_snapshot": "35b79c84efdea4fed7c9e490efd11f6e837ba86ded599d76ef02d6e9686e6b29",
    "retrieved_evidence": "7de0bab54209309513b2b8a5d17314e5b94044656d5dcf49c3b416eeed873fc3",
    "score": "9104fa05eb1c5d505b05892d47133caa21b33deba83a24a136a3fcc88446bf64"
  },
  "suite_content_identity": "sha256-raw-suite-v1:56dad240cc175fb3d3900875f05351b9541f9ef845aa54eddfc460151f3e257d"
}
