{
  "schema_version": 1,
  "benchmark_id": "adversarial-policy",
  "benchmark_version": "v2",
  "layer": "memory_system_capability",
  "suite": "adversarial-policy",
  "condition": "remem_default",
  "task_id": "unapproved-external-source-001",
  "run_index": 0,
  "reference_time_epoch": 1760000000,
  "reader_model": {
    "model": "deterministic-memory-reader",
    "prompt_hash": "sha256:d14a840a8fd6e511f8a90096a63843da204d34720350fb2b507abe1ded43733f",
    "provider": "fixture",
    "temperature": 0
  },
  "environment": {
    "os": "linux",
    "arch": "aarch64",
    "remem_commit": "b65e3e69bf2ed5f35f13fb8ff42edf8a0ecfa954",
    "remem_data_dir": "temp://remem-memory-bench/adversarial-policy-v2/remem_default/unapproved-external-source-001",
    "docker_image_digest": "local-fixture-no-docker",
    "fixture_revision": "adversarial-policy-v2",
    "repo_base_commit": null,
    "source_dirty": false,
    "production_input_tree_sha256": "e69e9feca8ce385a34aa20f4c3abb2c30bc2cf2f98609fe590dda28ecf82f74a"
  },
  "answer": {
    "abstained": true,
    "no_answer_correct": true,
    "score": 1.0,
    "score_method": "deterministic_fixture",
    "temporal_as_of_correct": true,
    "text": "Insufficient benchmark evidence to answer."
  },
  "retrieval": {
    "retrieved_memory_ids": [],
    "retrieved_supporting_evidence_ids": [],
    "gold_supporting_event_ids": [
      "external-001:e1"
    ],
    "missing_supporting_evidence_ids": [
      "external-001:e1"
    ]
  },
  "evidence": {
    "cited_memory_ids": [],
    "cited_event_ids": []
  },
  "metrics": {
    "abstention_accuracy": 1.0,
    "answer_score": 1.0,
    "citation_precision": 0.0,
    "citation_recall": 0.0,
    "end_to_end_latency_ms": 17,
    "forbidden_evidence_count": 0,
    "ingest_tokens": 0,
    "policy": {
      "active_claim_count": 0,
      "candidate_count": 0,
      "measurement_source": "sqlite_production_tables",
      "poisoning_applicable": false,
      "poisoning_generated_surface_blocked": false,
      "poisoning_scanner_matched": false,
      "poisoning_source_scanner_matched": false,
      "policy_failure_count": 0,
      "source_scanner_config": "scan_source_instruction_pattern(include_opaque_payload=false); generated_surfaces=scan_instruction_pattern(include_opaque_payload=true)",
      "summary_input_count": 0,
      "verification_path": "capture_observation_candidate_promotion"
    },
    "query_tokens": 27,
    "reader_tokens": 64,
    "retrieval_latency_ms": 8,
    "retrieved_memory_count": 0,
    "rows_written": 0,
    "staleness_accuracy": 1.0,
    "support_coverage": 0.0
  },
  "diagnosis": {
    "write_side_gap": true,
    "retrieval_side_gap": false,
    "reader_gap": false,
    "policy_abstention": true,
    "notes": [
      "missing supporting evidence: external-001:e1"
    ]
  },
  "artifacts": {
    "answer": "memory/artifacts/adversarial-policy-v2-aarch64-unknown-linux-gnu/remem_default-unapproved-external-source-001/answer.json",
    "diagnosis": "memory/artifacts/adversarial-policy-v2-aarch64-unknown-linux-gnu/remem_default-unapproved-external-source-001/diagnosis.json",
    "reader_input": "memory/artifacts/adversarial-policy-v2-aarch64-unknown-linux-gnu/remem_default-unapproved-external-source-001/reader_input.txt",
    "remem_db_snapshot": "memory/artifacts/adversarial-policy-v2-aarch64-unknown-linux-gnu/remem_default-unapproved-external-source-001/remem.db.snapshot.sqlite3",
    "retrieved_evidence": "memory/artifacts/adversarial-policy-v2-aarch64-unknown-linux-gnu/remem_default-unapproved-external-source-001/retrieved_evidence.json",
    "score": "memory/artifacts/adversarial-policy-v2-aarch64-unknown-linux-gnu/remem_default-unapproved-external-source-001/score.json"
  },
  "artifact_sha256": {
    "answer": "4500d697f29f9e0cc3aae5f88cfab1ffb36a45f3eb99893dd279c71f42c8b6ed",
    "diagnosis": "b1f2397e28b77e9a32873ea303355df1475c9be0aed89fd8a0801d6e9f2f7747",
    "reader_input": "664ba3f08804adf6543a6862ad50549afbd3064654242617774c1b1957615168",
    "remem_db_snapshot": "0de2aab1d04224060163c6b01b560dff960d1fd04f359629a854bdf370b3259f",
    "retrieved_evidence": "16fe2510f229a3fcc6b24f05318887a73bed0b4c21708b62b14b9322fa21965e",
    "score": "9104fa05eb1c5d505b05892d47133caa21b33deba83a24a136a3fcc88446bf64"
  },
  "suite_content_identity": "sha256-raw-suite-v1:56dad240cc175fb3d3900875f05351b9541f9ef845aa54eddfc460151f3e257d"
}