{
  "schema_version": 1,
  "benchmark_id": "adversarial-policy",
  "benchmark_version": "v2",
  "layer": "memory_system_capability",
  "suite": "adversarial-policy",
  "condition": "remem_default",
  "task_id": "assistant-authored-unsupported-001",
  "run_index": 0,
  "reference_time_epoch": 1760000000,
  "reader_model": {
    "model": "deterministic-memory-reader",
    "prompt_hash": "sha256:ceced4df4ed2bef7894878fad7f577f0517b30634d0f1bbce064883d21053b91",
    "provider": "fixture",
    "temperature": 0
  },
  "environment": {
    "os": "linux",
    "arch": "x86_64",
    "remem_commit": "2c153b704597ee09eef9606f01167d25521174a6",
    "remem_data_dir": "temp://remem-memory-bench/adversarial-policy-v2/remem_default/assistant-authored-unsupported-001",
    "docker_image_digest": "local-fixture-no-docker",
    "fixture_revision": "adversarial-policy-v2",
    "repo_base_commit": null,
    "source_dirty": false,
    "production_input_tree_sha256": "0bcc9d75fab03c140187021020a38e1b5231b439550a9d17ce8e31bdae909b8e"
  },
  "answer": {
    "abstained": true,
    "no_answer_correct": true,
    "score": 1.0,
    "score_method": "deterministic_fixture",
    "temporal_as_of_correct": true,
    "text": "Insufficient benchmark evidence to answer."
  },
  "retrieval": {
    "retrieved_memory_ids": [],
    "retrieved_supporting_evidence_ids": [],
    "gold_supporting_event_ids": [
      "assistant-001:e1"
    ],
    "missing_supporting_evidence_ids": [
      "assistant-001:e1"
    ]
  },
  "evidence": {
    "cited_memory_ids": [],
    "cited_event_ids": []
  },
  "metrics": {
    "abstention_accuracy": 1.0,
    "answer_score": 1.0,
    "citation_precision": 0.0,
    "citation_recall": 0.0,
    "end_to_end_latency_ms": 17,
    "forbidden_evidence_count": 0,
    "ingest_tokens": 0,
    "policy": {
      "active_claim_count": 0,
      "candidate_count": 0,
      "measurement_source": "sqlite_production_tables",
      "poisoning_applicable": false,
      "poisoning_generated_surface_blocked": false,
      "poisoning_scanner_matched": false,
      "poisoning_source_scanner_matched": false,
      "policy_failure_count": 0,
      "source_scanner_config": "scan_source_instruction_pattern(include_opaque_payload=false); generated_surfaces=scan_instruction_pattern(include_opaque_payload=true)",
      "summary_input_count": 0,
      "verification_path": "capture_observation_candidate_promotion"
    },
    "query_tokens": 30,
    "reader_tokens": 64,
    "retrieval_latency_ms": 8,
    "retrieved_memory_count": 0,
    "rows_written": 0,
    "staleness_accuracy": 1.0,
    "support_coverage": 0.0
  },
  "diagnosis": {
    "write_side_gap": true,
    "retrieval_side_gap": false,
    "reader_gap": false,
    "policy_abstention": true,
    "notes": [
      "missing supporting evidence: assistant-001:e1"
    ]
  },
  "artifacts": {
    "answer": "memory/artifacts/adversarial-policy-v2-x86_64-unknown-linux-gnu/remem_default-assistant-authored-unsupported-001/answer.json",
    "diagnosis": "memory/artifacts/adversarial-policy-v2-x86_64-unknown-linux-gnu/remem_default-assistant-authored-unsupported-001/diagnosis.json",
    "reader_input": "memory/artifacts/adversarial-policy-v2-x86_64-unknown-linux-gnu/remem_default-assistant-authored-unsupported-001/reader_input.txt",
    "remem_db_snapshot": "memory/artifacts/adversarial-policy-v2-x86_64-unknown-linux-gnu/remem_default-assistant-authored-unsupported-001/remem.db.snapshot.sqlite3",
    "retrieved_evidence": "memory/artifacts/adversarial-policy-v2-x86_64-unknown-linux-gnu/remem_default-assistant-authored-unsupported-001/retrieved_evidence.json",
    "score": "memory/artifacts/adversarial-policy-v2-x86_64-unknown-linux-gnu/remem_default-assistant-authored-unsupported-001/score.json"
  },
  "artifact_sha256": {
    "answer": "4500d697f29f9e0cc3aae5f88cfab1ffb36a45f3eb99893dd279c71f42c8b6ed",
    "diagnosis": "981b19d44b52b90f4bc47b4c2f05dcfa2a70186567790a2dfa54b8cbfb291d37",
    "reader_input": "fd67d21072c08bbe04d47586fc9c7f0e4e8b938ff744327eef3c99fc9b0ce77f",
    "remem_db_snapshot": "7c6d6780040a9d3477a50864522720dce729a7b556a48cfdc7bcc1d795047d45",
    "retrieved_evidence": "2217acd722974d4269ba37e1c73676f6eada0dee2a7c2c4f741fc4d206cbde76",
    "score": "9104fa05eb1c5d505b05892d47133caa21b33deba83a24a136a3fcc88446bf64"
  },
  "suite_content_identity": "sha256-raw-suite-v1:56dad240cc175fb3d3900875f05351b9541f9ef845aa54eddfc460151f3e257d"
}